{
  "schema_version": "1.0.0",
  "lineage_id": "lineage.round-06.worker-transition.synthetic",
  "classification": "synthetic-research-only",
  "effect": "records-lineage-only-no-truth-authority-publication-or-action",
  "sources": {
    "round_04_bundle": {
      "path": "integration/transition-bundle/fixtures/round-04.worker-option.complete.json",
      "sha256": "sha256:e609471d9a483e1a0b1b1cbf23b58c629ba69a5f73aea911f6dc570175ef290a",
      "bundle_id": "bundle.round-04.worker-option.complete",
      "bundle_schema_version": "1.2.0",
      "bundle_stage": "complete-core"
    },
    "governance_context": {
      "path": "governance/lineage/fixtures/round-06.worker-transition.governance-context.synthetic.json",
      "sha256": "sha256:e37e8b891cafb0e595f843d4d682944f63ac5770c9f45136b60962c457d4fed5",
      "context_id": "governance-context.round-06.worker-transition.synthetic",
      "context_hash": "sha256:93edaaf75b7ecdea807529ff1a476fa5245dc200e7be860938d1d702aad19262"
    },
    "negotiation": {
      "path": "governance/negotiation-record/fixtures/worker-transition.negotiation.synthetic.json",
      "sha256": "sha256:6a4b1f310e62f6dc43598571b8576ec2559a8ab89691549264d613c20fb056d3",
      "record_id": "negotiation.worker-transition.synthetic",
      "version": "1.0.0",
      "record_hash": "sha256:bd84b6a41237d929e200cd8fdedcd473d18b6d4091c5af7f3b77ada5af9e5ca1"
    },
    "decision": {
      "path": "governance/decision-record/fixtures/worker-transition.decision.synthetic.json",
      "sha256": "sha256:b9fc22b053f8c105f6ee179efeb66c0e0e16260a7afb70966250e0a7f7dc7920",
      "record_id": "decision.worker-transition.synthetic",
      "version": "1.0.0",
      "record_hash": "sha256:426ffd72c42751251fb4ad4412f1d95ccbf9cbb7610485c5a022c1fc0611d42c"
    }
  },
  "derived_if": {
    "condition_definition_ref": {
      "condition_id": "condition.worker-option.nsw",
      "definition_version": "1.0.0",
      "definition_hash": "sha256:f303ac32757a530947666c721d57deb4ba5174b61a1ae690e035303de5b23669"
    },
    "bundle_evaluation_hash": "sha256:190f6240785299773a1bd0e3d35400ecb17ae1b8cabef4e237f20282d935dcda",
    "evaluated_at": "2026-09-09T00:00:00Z",
    "mechanically_valid_for_evaluation": true,
    "computed_rule_state": "true",
    "governance_receipt_hash": "sha256:4965f8948f275ceabda4bc8c477dbfabebdf0fd58cc336d329851f78d4c28bec"
  },
  "boundaries": {
    "empirical_truth_established": false,
    "affected_party_consent_established": false,
    "authority_verified": false,
    "action_authorised": false,
    "publication_approved": false
  },
  "action_state": {
    "negotiation_activation_state": "blocked",
    "decision_activation_state": "blocked",
    "operational_effect": false
  },
  "lineage_hash": "sha256:ff1bb5e381570816cb9465498fc25cac0819916106e8a5cbe8ad8a120470da3c"
}
